{
    "title": "Daily Recap Day 1",
    "presentation_type": "Snackables",
    "categories": [
        "AI and ML",
        "EVENT-DAY1"
    ],
    "video_id": "Jj6PfCAQLUc",
    "time": "",
    "transcript": "hi everyone thanks for joining us forthis year's Cloud next we believe thatmaking AI helpful for everyone is themost important way we'll deliver on ourmission in the next decade[Music]we're now in the midst of one of themost profound technology shifts inhistoryour generative AI products aredelivering Real Results in every singlediscipline[Music]we appreciate being on thistransformation Journey with youtogether we're building the new way toCloud[Music]"
}