{
    "title": "Daily Recap Day 2",
    "presentation_type": "Snackables",
    "categories": [
        "AI and ML",
        "EVENT-DAY2"
    ],
    "video_id": "MdZ8lzTU7fw",
    "time": "",
    "transcript": "kubola is actually turning 25 this yearjust from Google Cloud can help us buildour next Legacyinterested in Duet AI but particularlyduet AI in app sheetsthis spring my team wrapped up one ofthe biggest data migrations in thehistory of the planetso you know we got to talk aboutsecurity got to talk about securityI always want to make sure that we canbuild experiences that are morepersonalized for our customers[Music]as a developer this is really getting mywheels turnedwe've got to put all that data to workbe able to use it using the power of AI[Music]I get so excited about this combinationof Open Source and managed toolingas efficiently and reliably as possible[Music]"
}